{
  "visual_style": "minimal emotional hand-drawn comic",
  "line_style": "thin stable black line",
  "palette": [
    "#F5F0E8",
    "#202020",
    "#E8B84A"
  ],
  "shading": "almost flat",
  "background": "simple quiet spaces",
  "lighting": "soft warm-to-cool progression",
  "texture": "subtle paper",
  "aspect_ratio": "9:16",
  "forbidden_styles": [
    "photorealistic",
    "3D render",
    "thick manga inks",
    "neon colors"
  ]
}
